[
  {
    "id": "esxi-vm-snapshots-deleted-via-api",
    "title": "ESXi Virtual Machine Snapshots Deleted via API",
    "description": "Detects removal of one or more virtual machine snapshots on a VMware ESXi host through a direct VIM API call (e.g. RemoveSnapshot_Task / RemoveAllSnapshots_Task), such as those issued by PowerCLI, govc, pyVmomi scripts, or any custom SOAP/REST client talking to hostd. Ransomware operators who have obtained ESXi credentials or a stolen vCenter/SSO session frequently delete every recoverable snapshot immediately before encrypting .vmdk files, so the victim cannot roll back instead of paying.",
    "analytic_story": ["VMware ESXi Ransomware Precursor Activity"],
    "type": "TTP",
    "status": "production",
    "severity": "high",
    "confidence": "high",
    "platform": "VMware ESXi",
    "product_version": "ESXi 6.5 - 8.0",
    "method": "API",
    "mitre_attack": {
      "tactics": [{ "id": "TA0040", "name": "Impact" }],
      "techniques": [{ "id": "T1490", "name": "Inhibit System Recovery", "url": "https://attack.mitre.org/techniques/T1490/" }]
    },
    "kill_chain_phases": ["Actions on Objectives"],
    "data_sources": [
      { "name": "hostd.log", "path": "/var/log/hostd.log", "description": "Records the VIM API task lifecycle for every snapshot operation (Task Created / Task Completed) including the sub=Vimsvc.TaskManager entry, the invoking user/session, and the target VM's vim.VirtualMachine MoRef." },
      { "name": "vpxd.log / vCenter Events", "path": "vCenter Server", "description": "If the host is managed by vCenter, VmRemoveAllSnapshotsEvent / VmRemoveSnapshotEvent appear in the Events table with full user attribution, which is far more reliable than hostd.log alone." }
    ],
    "detection_logic": "Search VMware task/event data for RemoveSnapshot_Task or RemoveAllSnapshots_Task completions, or the equivalent VmRemoveSnapshotEvent/VmRemoveAllSnapshotsEvent from vCenter, and alert when they occur outside of change windows, in a burst across multiple VMs, or are issued by an account that does not normally manage snapshots (e.g. root, a break-glass account, or a newly created SSO user).",
    "spl": "index=vmware sourcetype=vmware:vc:events (eventtype=VmRemoveAllSnapshotsEvent OR eventtype=VmRemoveSnapshotEvent)\n| stats count min(_time) as first_seen max(_time) as last_seen values(vm) as vms_affected by user, esxi_host\n| where count >= 1\n| eval risk_note=if(count>=3,\"Bulk snapshot deletion across multiple VMs - high-confidence ransomware precursor\",\"Single snapshot deletion - verify against change ticket\")",
    "cli_reference": "vSphere API: VirtualMachineSnapshot.RemoveSnapshot_Task / VirtualMachine.RemoveAllSnapshots_Task (commonly invoked via PowerCLI Remove-Snapshot, govc snapshot.remove, or pyVmomi)",
    "how_to_implement": "Forward hostd.log to your SIEM via esxcli system syslog config set --loghost=<collector>, and/or ingest vCenter Server task/event data (Splunk Add-on for VMware, vRealize Log Insight, or the vSphere Events API) so deletions are attributed to a real user identity rather than just 'root' on the host.",
    "known_false_positives": "Legitimate backup software (Veeam, Commvault, etc.) creates and removes snapshots as part of normal backup jobs and can trigger this at scale; baseline your backup service accounts and exclude their known job windows.",
    "investigation_steps": [
      "Identify the authenticated user/session and source IP that issued the task in vCenter events or the hostd opID.",
      "Determine whether the account is a known backup/orchestration service account with an expected job schedule.",
      "Check for correlated activity on the same host: VM power-off, autostart changes, firewall/coredump changes, or new SSH sessions in the same time window.",
      "Verify whether any VM files (.vmdk, .vmx) were modified or renamed immediately afterward, which would indicate active encryption."
    ],
    "risk_objects": [{ "field": "user", "type": "user" }, { "field": "esxi_host", "type": "system" }],
    "references": [
      { "title": "CISA AA23-039A: ESXiArgs Ransomware Virtual Machine Recovery Guidance", "url": "https://www.cisa.gov/news-events/cybersecurity-advisories/aa23-039a" },
      { "title": "VMware Security Blog: ESXi-Targeting Ransomware, Tactics and Techniques", "url": "https://blogs.vmware.com/security/2022/10/esxi-targeting-ransomware-tactics-and-techniques-part-2.html" }
    ],
    "related_detections": ["esxi-vm-snapshots-deleted-via-vim-cmd"],
    "tags": ["esxi", "vmware", "ransomware", "snapshot", "inhibit-system-recovery", "api"],
    "author": "Threat Detection Library",
    "created": "2026-08-12",
    "modified": "2026-08-12",
    "version": "1.0"
  },
  {
    "id": "esxi-autostart-settings-modified-via-api",
    "title": "ESXi Autostart Settings Modified via API",
    "description": "Detects changes to a host's virtual machine AutoStart/AutoStop defaults or per-VM autostart entries made through the vSphere API (HostAutoStartManager.ReconfigureAutostart / UpdateDefaults / UpdateAutoStartEntry). Attackers disable autostart so that, after powering off VMs or rebooting the host, workloads do not automatically resume and expose the still-unencrypted disks - or, inversely, so a malicious VM they planted starts automatically on boot.",
    "analytic_story": ["VMware ESXi Ransomware Precursor Activity"],
    "type": "TTP",
    "status": "production",
    "severity": "medium",
    "confidence": "medium",
    "platform": "VMware ESXi",
    "product_version": "ESXi 6.5 - 8.0",
    "method": "API",
    "mitre_attack": {
      "tactics": [{ "id": "TA0040", "name": "Impact" }],
      "techniques": [
        { "id": "T1489", "name": "Service Stop", "url": "https://attack.mitre.org/techniques/T1489/" },
        { "id": "T1490", "name": "Inhibit System Recovery", "url": "https://attack.mitre.org/techniques/T1490/" }
      ]
    },
    "kill_chain_phases": ["Actions on Objectives"],
    "data_sources": [
      { "name": "hostd.log", "path": "/var/log/hostd.log", "description": "Logs HostAutoStartManager.ReconfigureAutostart / UpdateDefaults / UpdateAutoStartEntry task creation and completion with the invoking session." },
      { "name": "vCenter Events", "path": "vCenter Server", "description": "HostAutoStartConfiguredForVM style entries when driven through vCenter." }
    ],
    "detection_logic": "Alert on HostAutoStartManager reconfiguration tasks, especially those that set the global 'enabled' default to false or change per-VM startAction/waitForHeartbeat entries to 'none', outside of documented maintenance windows.",
    "spl": "index=vmware sourcetype=vmware:esxi:hostd sub=\"Vimsvc.TaskManager\" (\"HostAutoStartManager.ReconfigureAutostart\" OR \"UpdateAutoStartEntry\" OR \"UpdateDefaults\")\n| rex field=_raw \"user=(?<user>[^\\]\\s]+)\"\n| stats count values(_raw) as evidence by user, host\n| where count > 0",
    "cli_reference": "vSphere API: HostAutoStartManager.ReconfigureAutostart / UpdateDefaults / UpdateAutoStartEntry (commonly invoked via PowerCLI Set-VMHostStartPolicy or govc host.autostart.*)",
    "how_to_implement": "Ensure hostd.log is forwarded and, where possible, correlate with vCenter's HostConfigChangedEvent so the responsible identity is captured rather than just 'root' on the host.",
    "known_false_positives": "Legitimate infrastructure automation (Ansible, Terraform vsphere provider, cluster build-out scripts) commonly configures autostart during host provisioning; baseline expected change windows and CMDB-registered automation accounts.",
    "investigation_steps": [
      "Confirm whether the change is tied to a documented provisioning or DR runbook.",
      "Check whether the 'enabled' default flipped from true to false, or whether specific high-value VMs were pulled out of the autostart list.",
      "Correlate with subsequent VM power-off or snapshot-deletion events on the same host."
    ],
    "risk_objects": [{ "field": "user", "type": "user" }, { "field": "host", "type": "system" }],
    "references": [
      { "title": "Broadcom TechDocs: Configure Virtual Machine Startup and Shutdown Settings", "url": "https://techdocs.broadcom.com/us/en/vmware-cis/vsphere/vsphere/8-0.html" }
    ],
    "related_detections": ["esxi-vm-autostart-disabled-via-vim-cmd"],
    "tags": ["esxi", "vmware", "ransomware", "autostart", "api"],
    "author": "Threat Detection Library",
    "created": "2026-08-12",
    "modified": "2026-08-12",
    "version": "1.0"
  },
  {
    "id": "esxi-vm-powered-off-via-api",
    "title": "ESXi Virtual Machine Powered Off via ESXi API",
    "description": "Detects one or more virtual machines being powered off through the vSphere API (VirtualMachine.PowerOffVM_Task) rather than through in-guest shutdown. Encryptors used by ESXi-targeting ransomware families (e.g. LockBit, Black Basta, Akira, RansomHub) power off every running VM first to release the .vmdk file locks held by the running VMX process, which is a prerequisite for encrypting the files.",
    "analytic_story": ["VMware ESXi Ransomware Precursor Activity"],
    "type": "TTP",
    "status": "production",
    "severity": "critical",
    "confidence": "high",
    "platform": "VMware ESXi",
    "product_version": "ESXi 6.5 - 8.0",
    "method": "API",
    "mitre_attack": {
      "tactics": [{ "id": "TA0040", "name": "Impact" }],
      "techniques": [{ "id": "T1489", "name": "Service Stop", "url": "https://attack.mitre.org/techniques/T1489/" }]
    },
    "kill_chain_phases": ["Actions on Objectives"],
    "data_sources": [
      { "name": "hostd.log", "path": "/var/log/hostd.log", "description": "Logs PowerOffVM_Task creation/completion for each VM MoRef." },
      { "name": "vobd.log", "path": "/var/log/vobd.log", "description": "Emits VM power-state VOB observations that can corroborate a mass power-off independent of hostd." },